{
	"$schema": "https://json-schema.org/draft/2020-12/schema",
	"$id": "https://linked.art/api/1.0/schema/text.json",
	"title": "Text Schema",
	"description": "_crm:E33\\_Linguistic\\_Object_\nTextual content expressed in one or more human languages, which might or might not be written down on any physical carrier.\nSee: [API](https://linked.art/api/1.0/endpoint/textual_work/) | [Model](https://linked.art/model/document/)",
	"type": "object",
	"properties": {
		"@context": {"$ref": "core.json#/definitions/ContextStringOrArray"},
		"id": {"$ref": "core.json#/definitions/idProp"},				
		"type": {"allOf": [{"title": "General", "$ref": "core.json#/definitions/typeProp"}, 
			{"title": "Specific", "type": "string", "const": "LinguisticObject"}]},
		"_label": {"$ref": "core.json#/definitions/labelProp"},
		"identified_by": {"$ref": "core.json#/definitions/identified_byProp"},
		"classified_as": {"$ref": "core.json#/definitions/classified_asProp"},
		"referred_to_by": {"$ref": "core.json#/definitions/referred_to_byProp"},
		"equivalent": {"allOf": [{"title": "General", "$ref": "core.json#/definitions/equivalentProp"}, 
			{"title": "Specific", "description": "List of equivalent `LinguisticObject` entities", "type": "array", "items": {"$ref": "core.json#/definitions/LinguisticObjectRef"}}]},
		"representation": {"$ref": "core.json#/definitions/representationProp"},
		"member_of": {"$ref": "core.json#/definitions/member_ofSetProp"},
		"subject_of": {"$ref": "core.json#/definitions/subject_ofProp"},
		"attributed_by": {"$ref": "core.json#/definitions/attributed_byRelProp"},
		"dimension": {"$ref": "core.json#/definitions/dimensionProp"},
		"subject_to": {"$ref": "core.json#/definitions/subject_toProp"},		
        "format": {"$ref": "core.json#/definitions/formatProp"},
		"language": {"$ref": "core.json#/definitions/languageProp"},
		"about": {"$ref": "core.json#/definitions/aboutProp"},
		"created_by": {"title": "crm:P94i_was_created_by", "$ref": "core.json#/definitions/Creation"},
		"used_for": {
			"title": "crm:P16i_was_used_for", 
			"description": "", 
			"type": "array", 
			"items": {"$ref": "core.json#/definitions/Activity"}},
		"part_of": {
			"title": "crm:P106i_forms_part_of",
			"description": "Reference to another Linguistic Object of which this is part", 
			"type": "array",
			"items": {"$ref": "core.json#/definitions/LinguisticObjectRef"}},
        "content": {"$ref": "core.json#/definitions/contentProp"}
	},
	"required": ["@context", "id", "type", "_label"],
	"additionalProperties": false
}