{
  "@context": "https://linked.art/ns/v1/linked-art.json",
  "id": "https://linked.art/example/text/koot_nightwatch/40",
  "type": "LinguisticObject",
  "_label": "Content of Koot's Night Watch",
  "used_for": [
    {
      "type": "Activity",
      "_label": "MI's Publishing",
      "classified_as": [
        {
          "id": "http://vocab.getty.edu/aat/300054686",
          "type": "Type",
          "_label": "Publishing"
        }
      ],
      "carried_out_by": [
        {
          "id": "https://linked.art/example/group/meulenhoff",
          "type": "Group",
          "_label": "Meulenhoff International"
        }
      ]
    }
  ]
}